{
  "schema_version": "1.0",
  "event_type": "purchase",
  "event_id": "evt_signed_001",
  "created_at": "2026-08-22T22:00:00Z",
  "transaction": { "transaction_id": "txn_signed_001", "purchased_at": "2026-08-22T21:59:00Z", "currency": "USD", "channel": "online" },
  "merchant": { "merchant_id": "merchant_signed_demo", "name": "Example Signed Merchant" },
  "items": [{
    "item_id": "line_1",
    "name": "Prepared Salad",
    "quantity": { "count": 1 },
    "nutrition": { "basis": "purchased_quantity", "energy_kcal": 310, "protein_g": 12, "carbohydrate_g": 28, "fat_g": 18 },
    "provenance": { "source_type": "retailer", "source_id": "recipe-salad-3", "source_name": "Example Signed Merchant", "method": "recipe_calculation", "trust_level": "verified" }
  }],
  "consumption_state": "purchased",
  "provenance": { "generated_by": "Example Signed Merchant", "trust_level": "verified" },
  "signature": { "algorithm": "Ed25519", "key_id": "https://merchant.example/.well-known/opennutri-keys.json#2026-01", "value": "BASE64URL_SIGNATURE_PLACEHOLDER", "signed_at": "2026-08-22T22:00:00Z" }
}
